[
    {
        "mavenCoordinates": {
            "groupId": "com.squareup.retrofit2",
            "artifactId": "retrofit",
            "version": "2.3.0"
        },
        "name": "Retrofit",
        "description": null,
        "licenses": [
            {
                "spdxLicenseIdentifier": "Apache-2.0",
                "name": "Apache License 2.0",
                "url": "https://spdx.org/licenses/Apache-2.0.html"
            }
        ]
    }
]